{
  "$schema": "https://json-schema.org/draft/2020-12/schema",
  "$id": "https://github.com/tt-a1i/archify/schemas/architecture.schema.json",
  "title": "Archify Architecture Diagram",
  "$defs": {
    "internalStructureSourceRefs": {
      "type": "array",
      "minItems": 1,
      "maxItems": 3,
      "items": { "$ref": "common.schema.json#/$defs/id" }
    },
    "internalStructureSource": {
      "type": "object",
      "additionalProperties": false,
      "required": ["id", "role", "path"],
      "properties": {
        "id": { "$ref": "common.schema.json#/$defs/id" },
        "role": { "enum": ["definition", "export", "registration", "callsite", "guard", "test", "schema", "documentation"] },
        "symbol": { "type": "string", "minLength": 1, "maxLength": 200, "pattern": "^\\S(?:[\\s\\S]*\\S)?$" },
        "path": { "type": "string", "minLength": 1, "maxLength": 240 },
        "line": { "type": "integer", "minimum": 1 },
        "end_line": { "type": "integer", "minimum": 1 },
        "label": { "type": "string", "minLength": 1, "maxLength": 48 }
      }
    },
    "internalStructureCodeItem": {
      "type": "object",
      "additionalProperties": false,
      "required": ["id", "domain", "kind", "label", "summary"],
      "properties": {
        "id": { "$ref": "common.schema.json#/$defs/id" },
        "domain": { "const": "code" },
        "kind": { "enum": ["directory", "file", "class", "interface", "type", "function", "method"] },
        "label": { "type": "string", "minLength": 1, "maxLength": 80 },
        "summary": { "type": "string", "minLength": 1, "maxLength": 240 },
        "parent": { "$ref": "common.schema.json#/$defs/id" },
        "signature": { "type": "string", "minLength": 1, "maxLength": 200 },
        "source_refs": { "$ref": "#/$defs/internalStructureSourceRefs" }
      }
    },
    "internalStructureStateGroup": {
      "type": "object",
      "additionalProperties": false,
      "required": ["id", "domain", "kind", "label", "summary"],
      "properties": {
        "id": { "$ref": "common.schema.json#/$defs/id" },
        "domain": { "const": "state" },
        "kind": { "const": "group" },
        "label": { "type": "string", "minLength": 1, "maxLength": 80 },
        "summary": { "type": "string", "minLength": 1, "maxLength": 240 },
        "parent": { "$ref": "common.schema.json#/$defs/id" },
        "source_refs": { "$ref": "#/$defs/internalStructureSourceRefs" }
      }
    },
    "internalStructureStateField": {
      "type": "object",
      "additionalProperties": false,
      "required": ["id", "domain", "kind", "label", "summary", "value_type", "source_refs"],
      "properties": {
        "id": { "$ref": "common.schema.json#/$defs/id" },
        "domain": { "const": "state" },
        "kind": { "const": "field" },
        "label": { "type": "string", "minLength": 1, "maxLength": 80 },
        "summary": { "type": "string", "minLength": 1, "maxLength": 240 },
        "parent": { "$ref": "common.schema.json#/$defs/id" },
        "value_type": { "type": "string", "minLength": 1, "maxLength": 200 },
        "source_refs": { "$ref": "#/$defs/internalStructureSourceRefs" }
      }
    },
    "internalStructureRelation": {
      "type": "object",
      "additionalProperties": false,
      "required": ["id", "from", "to", "kind", "source_refs"],
      "properties": {
        "id": { "$ref": "common.schema.json#/$defs/id" },
        "from": { "$ref": "common.schema.json#/$defs/id" },
        "to": { "$ref": "common.schema.json#/$defs/id" },
        "kind": { "enum": ["imports", "calls", "uses", "creates", "reads", "writes"] },
        "label": { "type": "string", "minLength": 1, "maxLength": 80 },
        "source_refs": { "$ref": "#/$defs/internalStructureSourceRefs" }
      }
    },
    "internalStructure": {
      "type": "object",
      "additionalProperties": false,
      "required": ["sources", "items", "relations"],
      "properties": {
        "sources": { "type": "array", "minItems": 1, "maxItems": 64, "items": { "$ref": "#/$defs/internalStructureSource" } },
        "items": {
          "type": "array",
          "minItems": 1,
          "maxItems": 64,
          "items": { "oneOf": [
            { "$ref": "#/$defs/internalStructureCodeItem" },
            { "$ref": "#/$defs/internalStructureStateGroup" },
            { "$ref": "#/$defs/internalStructureStateField" }
          ] }
        },
        "relations": { "type": "array", "maxItems": 96, "items": { "$ref": "#/$defs/internalStructureRelation" } }
      }
    }
  },
  "type": "object",
  "additionalProperties": false,
  "required": ["schema_version", "diagram_type", "meta", "components"],
  "properties": {
    "schema_version": { "const": 1 },
    "diagram_type": { "const": "architecture" },
    "meta": {
      "type": "object",
      "additionalProperties": false,
      "required": ["title"],
      "properties": {
        "title": { "type": "string", "minLength": 1 },
        "locale": { "$ref": "common.schema.json#/$defs/locale" },
        "subtitle": { "type": "string" },
        "output": { "type": "string" },
        "animation": { "$ref": "common.schema.json#/$defs/animation" },
        "visual_preset": { "$ref": "common.schema.json#/$defs/visualPreset" },
        "quality_profile": { "$ref": "common.schema.json#/$defs/qualityProfile" },
        "engineering_profile": { "enum": ["deployment-ownership"] },
        "repository": {
          "type": "object",
          "additionalProperties": false,
          "required": ["url", "revision"],
          "properties": {
            "url": {
              "type": "string",
              "minLength": 1
            },
            "provider": { "enum": ["github", "gitee"] },
            "link_mode": { "enum": ["web", "local-only"] },
            "revision": { "type": "string", "pattern": "^[a-fA-F0-9]{40}$" }
          }
        },
        "views": { "$ref": "common.schema.json#/$defs/guidedViews" },
        "legend": {
          "type": "object",
          "additionalProperties": false,
          "properties": {
            "mode": { "$ref": "common.schema.json#/$defs/legendMode" },
            "entries": {
              "type": "object",
              "additionalProperties": false,
              "properties": {
                "frontend": { "$ref": "common.schema.json#/$defs/legendEntry" },
                "backend": { "$ref": "common.schema.json#/$defs/legendEntry" },
                "database": { "$ref": "common.schema.json#/$defs/legendEntry" },
                "cloud": { "$ref": "common.schema.json#/$defs/legendEntry" },
                "security": { "$ref": "common.schema.json#/$defs/legendEntry" },
                "messagebus": { "$ref": "common.schema.json#/$defs/legendEntry" },
                "external": { "$ref": "common.schema.json#/$defs/legendEntry" }
              }
            }
          }
        },
        "viewBox": {
          "type": "array",
          "prefixItems": [
            { "type": "number", "minimum": 320 },
            { "type": "number", "minimum": 240 }
          ],
          "items": false,
          "minItems": 2,
          "maxItems": 2
        }
      }
    },
    "layout": {
      "type": "object",
      "additionalProperties": false,
      "required": ["mode"],
      "properties": {
        "mode": { "enum": ["grid"] },
        "origin": { "$ref": "common.schema.json#/$defs/point" },
        "cols": { "type": "integer", "minimum": 1, "maximum": 12 },
        "gapX": { "type": "number", "minimum": 0 },
        "gapY": { "type": "number", "minimum": 0 },
        "cellW": { "type": "number", "minimum": 40 },
        "cellH": { "type": "number", "minimum": 24 }
      }
    },
    "components": {
      "type": "array",
      "minItems": 1,
      "items": {
        "type": "object",
        "additionalProperties": false,
        "required": ["id", "type", "label"],
        "properties": {
          "id": { "$ref": "common.schema.json#/$defs/id" },
          "type": { "$ref": "common.schema.json#/$defs/componentType" },
          "label": { "type": "string", "minLength": 1 },
          "sublabel": { "type": "string" },
          "tag": { "type": "string" },
          "brand": { "$ref": "common.schema.json#/$defs/brandMark" },
          "sources": {
            "type": "array",
            "minItems": 1,
            "maxItems": 3,
            "items": {
              "type": "object",
              "additionalProperties": false,
              "required": ["path"],
              "properties": {
                "id": { "$ref": "common.schema.json#/$defs/id" },
                "role": { "enum": ["definition", "export", "registration", "callsite", "guard", "test", "schema", "documentation"] },
                "symbol": { "type": "string", "minLength": 1, "maxLength": 200, "pattern": "^\\S(?:[\\s\\S]*\\S)?$" },
                "path": { "type": "string", "minLength": 1, "maxLength": 240 },
                "line": { "type": "integer", "minimum": 1 },
                "end_line": { "type": "integer", "minimum": 1 },
                "label": { "type": "string", "minLength": 1, "maxLength": 48 }
              }
            }
          },
          "internal_structure": { "$ref": "#/$defs/internalStructure" },
          "row": { "type": "integer", "minimum": 0 },
          "col": { "type": "integer", "minimum": 0 },
          "pos": { "$ref": "common.schema.json#/$defs/point" },
          "size": {
            "type": "array",
            "prefixItems": [
              { "type": "number", "exclusiveMinimum": 0 },
              { "type": "number", "exclusiveMinimum": 0 }
            ],
            "items": false,
            "minItems": 2,
            "maxItems": 2
          }
        }
      }
    },
    "boundaries": {
      "type": "array",
      "items": {
        "type": "object",
        "additionalProperties": false,
        "required": ["kind", "label", "wraps"],
        "properties": {
          "kind": { "enum": ["region", "security-group"] },
          "label": { "type": "string", "minLength": 1 },
          "wraps": {
            "type": "array",
            "minItems": 1,
            "items": { "$ref": "common.schema.json#/$defs/id" }
          },
          "pad": { "type": "number", "minimum": 0 }
        }
      }
    },
    "connections": {
      "type": "array",
      "items": {
        "type": "object",
        "additionalProperties": false,
        "required": ["from", "to"],
        "properties": {
          "id": { "$ref": "common.schema.json#/$defs/id" },
          "from": { "$ref": "common.schema.json#/$defs/id" },
          "to": { "$ref": "common.schema.json#/$defs/id" },
          "label": { "type": "string" },
          "variant": { "$ref": "common.schema.json#/$defs/variant" },
          "fromSide": { "$ref": "common.schema.json#/$defs/side" },
          "toSide": { "$ref": "common.schema.json#/$defs/side" },
          "route": { "enum": ["auto", "straight", "orthogonal-h", "orthogonal-v"] },
          "via": {
            "type": "array",
            "items": { "$ref": "common.schema.json#/$defs/point" }
          },
          "labelAt": { "$ref": "common.schema.json#/$defs/point" },
          "labelDx": { "type": "number" },
          "labelDy": { "type": "number" },
          "labelSegment": { "type": "integer", "minimum": 0 },
          "width": { "$ref": "common.schema.json#/$defs/relationshipWidth" }
        }
      }
    },
    "cards": { "$ref": "common.schema.json#/$defs/cards" }
  }
}
