{
  "schema_version": 1,
  "diagram_type": "architecture",
  "meta": {
    "title": "20 节点架构图",
    "locale": "zh-CN",
    "quality_profile": "showcase"
  },
  "components": [
    {
      "id": "node1",
      "type": "backend",
      "label": "执行器 01",
      "sublabel": "detail / 01",
      "pos": [
        40,
        40
      ],
      "size": [
        130,
        60
      ]
    },
    {
      "id": "node2",
      "type": "backend",
      "label": "执行器 02",
      "sublabel": "detail / 02",
      "pos": [
        205,
        40
      ],
      "size": [
        130,
        60
      ]
    },
    {
      "id": "node3",
      "type": "backend",
      "label": "执行器 03",
      "sublabel": "detail / 03",
      "pos": [
        370,
        40
      ],
      "size": [
        130,
        60
      ]
    },
    {
      "id": "node4",
      "type": "backend",
      "label": "执行器 04",
      "sublabel": "detail / 04",
      "pos": [
        535,
        40
      ],
      "size": [
        130,
        60
      ]
    },
    {
      "id": "node5",
      "type": "backend",
      "label": "执行器 05",
      "sublabel": "detail / 05",
      "pos": [
        700,
        40
      ],
      "size": [
        130,
        60
      ]
    },
    {
      "id": "node6",
      "type": "backend",
      "label": "执行器 06",
      "sublabel": "detail / 06",
      "pos": [
        40,
        140
      ],
      "size": [
        130,
        60
      ]
    },
    {
      "id": "node7",
      "type": "backend",
      "label": "执行器 07",
      "sublabel": "detail / 07",
      "pos": [
        205,
        140
      ],
      "size": [
        130,
        60
      ]
    },
    {
      "id": "node8",
      "type": "backend",
      "label": "执行器 08",
      "sublabel": "detail / 08",
      "pos": [
        370,
        140
      ],
      "size": [
        130,
        60
      ]
    },
    {
      "id": "node9",
      "type": "backend",
      "label": "执行器 09",
      "sublabel": "detail / 09",
      "pos": [
        535,
        140
      ],
      "size": [
        130,
        60
      ]
    },
    {
      "id": "node10",
      "type": "backend",
      "label": "执行器 10",
      "sublabel": "detail / 10",
      "pos": [
        700,
        140
      ],
      "size": [
        130,
        60
      ]
    },
    {
      "id": "node11",
      "type": "backend",
      "label": "执行器 11",
      "sublabel": "detail / 11",
      "pos": [
        40,
        240
      ],
      "size": [
        130,
        60
      ]
    },
    {
      "id": "node12",
      "type": "backend",
      "label": "执行器 12",
      "sublabel": "detail / 12",
      "pos": [
        205,
        240
      ],
      "size": [
        130,
        60
      ]
    },
    {
      "id": "node13",
      "type": "backend",
      "label": "执行器 13",
      "sublabel": "detail / 13",
      "pos": [
        370,
        240
      ],
      "size": [
        130,
        60
      ]
    },
    {
      "id": "node14",
      "type": "backend",
      "label": "执行器 14",
      "sublabel": "detail / 14",
      "pos": [
        535,
        240
      ],
      "size": [
        130,
        60
      ]
    },
    {
      "id": "node15",
      "type": "backend",
      "label": "执行器 15",
      "sublabel": "detail / 15",
      "pos": [
        700,
        240
      ],
      "size": [
        130,
        60
      ]
    },
    {
      "id": "node16",
      "type": "backend",
      "label": "执行器 16",
      "sublabel": "detail / 16",
      "pos": [
        40,
        340
      ],
      "size": [
        130,
        60
      ]
    },
    {
      "id": "node17",
      "type": "backend",
      "label": "执行器 17",
      "sublabel": "detail / 17",
      "pos": [
        205,
        340
      ],
      "size": [
        130,
        60
      ]
    },
    {
      "id": "node18",
      "type": "backend",
      "label": "执行器 18",
      "sublabel": "detail / 18",
      "pos": [
        370,
        340
      ],
      "size": [
        130,
        60
      ]
    },
    {
      "id": "node19",
      "type": "backend",
      "label": "执行器 19",
      "sublabel": "detail / 19",
      "pos": [
        535,
        340
      ],
      "size": [
        130,
        60
      ]
    },
    {
      "id": "node20",
      "type": "backend",
      "label": "执行器 20",
      "sublabel": "detail / 20",
      "pos": [
        700,
        340
      ],
      "size": [
        130,
        60
      ]
    }
  ],
  "connections": [
    {
      "id": "relation1",
      "from": "node1",
      "to": "node2"
    },
    {
      "id": "relation2",
      "from": "node2",
      "to": "node3"
    },
    {
      "id": "relation3",
      "from": "node3",
      "to": "node4"
    },
    {
      "id": "relation4",
      "from": "node4",
      "to": "node5"
    },
    {
      "id": "relation6",
      "from": "node6",
      "to": "node7"
    },
    {
      "id": "relation7",
      "from": "node7",
      "to": "node8"
    },
    {
      "id": "relation8",
      "from": "node8",
      "to": "node9"
    },
    {
      "id": "relation9",
      "from": "node9",
      "to": "node10"
    },
    {
      "id": "relation11",
      "from": "node11",
      "to": "node12"
    },
    {
      "id": "relation12",
      "from": "node12",
      "to": "node13"
    },
    {
      "id": "relation13",
      "from": "node13",
      "to": "node14"
    },
    {
      "id": "relation14",
      "from": "node14",
      "to": "node15"
    },
    {
      "id": "relation16",
      "from": "node16",
      "to": "node17"
    },
    {
      "id": "relation17",
      "from": "node17",
      "to": "node18"
    },
    {
      "id": "relation18",
      "from": "node18",
      "to": "node19"
    },
    {
      "id": "relation19",
      "from": "node19",
      "to": "node20"
    }
  ]
}
